<?xml version="1.0" encoding="UTF-8" ?>
<!DOCTYPE menu SYSTEM "../dtd/menu.dtd">
<menu from="June" to="August">
    <name>Winter warmers</name>
    <description>Sample menu: Things we sell in cold weather</description>
    <fooditem>
        <code>burg</code>
    </fooditem>
    <fooditem>
        <code>chowder</code>
    </fooditem>
    <fooditem>
        <code>deep fried soup</code>
    </fooditem>
    <fooditem>
        <code>garlic bread</code>
    </fooditem>
    <fooditem>
        <code>cocktail</code>
    </fooditem>
    <fooditem>
        <code>hot choc</code>
    </fooditem>
</menu>